{
  "observations_schema": "helix.mongodb-upstream-observations/1",
  "profile": "mongodb-6.0.5-initial-v1",
  "cases_source_sha256": "31125f8841bd1b6f3789d54608e531e88304d9dedcfcf5e71f1dd92566521235",
  "client": {
    "product": "MongoDB Shell",
    "version": "1.8.0"
  },
  "upstream": {
    "product": "MongoDB Community Server",
    "version": "6.0.5",
    "git_version": "c9a99c120371d4d4c52cbb15dac34a36ce8d3b1d",
    "feature_compatibility_version": "6.0",
    "max_wire_version": 17,
    "modules": [],
    "image": "mongo@sha256:928347070dc089a596f869a22a4204c0feace3eb03470a6a2de6814f11fb7309",
    "image_id": "sha256:8b33e239cde686e9378f9d8941eafa167fdf73527e9e006ab1fe9174c9622797"
  },
  "cases": [
    {
      "id": "array.all.direct",
      "rows": [
        {
          "_id": {
            "$numberInt": "1"
          },
          "a": [
            {
              "$numberInt": "1"
            },
            {
              "$numberInt": "2"
            }
          ],
          "profile": {
            "age": {
              "$numberInt": "21"
            }
          },
          "items": [
            {
              "v": {
                "$numberInt": "1"
              }
            },
            {
              "v": {
                "$numberInt": "2"
              }
            }
          ],
          "s": "é",
          "obj": {
            "a": {
              "$numberInt": "1"
            },
            "b": {
              "$numberInt": "2"
            }
          },
          "n": {
            "$numberInt": "1"
          }
        },
        {
          "_id": {
            "$numberInt": "2"
          },
          "x": null,
          "a": [
            {
              "$numberInt": "2"
            },
            {
              "$numberInt": "3"
            }
          ],
          "profile": {
            "age": {
              "$numberInt": "17"
            }
          },
          "items": [
            {
              "v": {
                "$numberInt": "3"
              }
            }
          ],
          "s": "é",
          "obj": {
            "b": {
              "$numberInt": "2"
            },
            "a": {
              "$numberInt": "1"
            }
          },
          "n": {
            "$numberLong": "1"
          }
        },
        {
          "_id": {
            "$numberInt": "5"
          },
          "x": false,
          "a": [
            {
              "$numberInt": "2"
            }
          ],
          "profile": {
            "age": {
              "$numberInt": "18"
            }
          },
          "items": [
            {
              "v": {
                "$numberInt": "2"
              }
            },
            {
              "v": {
                "$numberInt": "2"
              }
            }
          ],
          "s": "é",
          "obj": {
            "a": {
              "$numberInt": "1"
            },
            "b": {
              "$numberInt": "2"
            }
          },
          "n": {
            "$numberDecimal": "0.1"
          }
        }
      ]
    },
    {
      "id": "array.elem-match.direct",
      "rows": [
        {
          "_id": {
            "$numberInt": "1"
          },
          "a": [
            {
              "$numberInt": "1"
            },
            {
              "$numberInt": "2"
            }
          ],
          "profile": {
            "age": {
              "$numberInt": "21"
            }
          },
          "items": [
            {
              "v": {
                "$numberInt": "1"
              }
            },
            {
              "v": {
                "$numberInt": "2"
              }
            }
          ],
          "s": "é",
          "obj": {
            "a": {
              "$numberInt": "1"
            },
            "b": {
              "$numberInt": "2"
            }
          },
          "n": {
            "$numberInt": "1"
          }
        },
        {
          "_id": {
            "$numberInt": "2"
          },
          "x": null,
          "a": [
            {
              "$numberInt": "2"
            },
            {
              "$numberInt": "3"
            }
          ],
          "profile": {
            "age": {
              "$numberInt": "17"
            }
          },
          "items": [
            {
              "v": {
                "$numberInt": "3"
              }
            }
          ],
          "s": "é",
          "obj": {
            "b": {
              "$numberInt": "2"
            },
            "a": {
              "$numberInt": "1"
            }
          },
          "n": {
            "$numberLong": "1"
          }
        },
        {
          "_id": {
            "$numberInt": "5"
          },
          "x": false,
          "a": [
            {
              "$numberInt": "2"
            }
          ],
          "profile": {
            "age": {
              "$numberInt": "18"
            }
          },
          "items": [
            {
              "v": {
                "$numberInt": "2"
              }
            },
            {
              "v": {
                "$numberInt": "2"
              }
            }
          ],
          "s": "é",
          "obj": {
            "a": {
              "$numberInt": "1"
            },
            "b": {
              "$numberInt": "2"
            }
          },
          "n": {
            "$numberDecimal": "0.1"
          }
        }
      ]
    },
    {
      "id": "array.scalar-equality.direct",
      "rows": [
        {
          "_id": {
            "$numberInt": "1"
          },
          "a": [
            {
              "$numberInt": "1"
            },
            {
              "$numberInt": "2"
            }
          ],
          "profile": {
            "age": {
              "$numberInt": "21"
            }
          },
          "items": [
            {
              "v": {
                "$numberInt": "1"
              }
            },
            {
              "v": {
                "$numberInt": "2"
              }
            }
          ],
          "s": "é",
          "obj": {
            "a": {
              "$numberInt": "1"
            },
            "b": {
              "$numberInt": "2"
            }
          },
          "n": {
            "$numberInt": "1"
          }
        },
        {
          "_id": {
            "$numberInt": "2"
          },
          "x": null,
          "a": [
            {
              "$numberInt": "2"
            },
            {
              "$numberInt": "3"
            }
          ],
          "profile": {
            "age": {
              "$numberInt": "17"
            }
          },
          "items": [
            {
              "v": {
                "$numberInt": "3"
              }
            }
          ],
          "s": "é",
          "obj": {
            "b": {
              "$numberInt": "2"
            },
            "a": {
              "$numberInt": "1"
            }
          },
          "n": {
            "$numberLong": "1"
          }
        },
        {
          "_id": {
            "$numberInt": "5"
          },
          "x": false,
          "a": [
            {
              "$numberInt": "2"
            }
          ],
          "profile": {
            "age": {
              "$numberInt": "18"
            }
          },
          "items": [
            {
              "v": {
                "$numberInt": "2"
              }
            },
            {
              "v": {
                "$numberInt": "2"
              }
            }
          ],
          "s": "é",
          "obj": {
            "a": {
              "$numberInt": "1"
            },
            "b": {
              "$numberInt": "2"
            }
          },
          "n": {
            "$numberDecimal": "0.1"
          }
        }
      ]
    },
    {
      "id": "array.scalar-equality.rewrite",
      "rows": [
        {
          "_id": {
            "$numberInt": "1"
          },
          "a": [
            {
              "$numberInt": "1"
            },
            {
              "$numberInt": "2"
            }
          ],
          "profile": {
            "age": {
              "$numberInt": "21"
            }
          },
          "items": [
            {
              "v": {
                "$numberInt": "1"
              }
            },
            {
              "v": {
                "$numberInt": "2"
              }
            }
          ],
          "s": "é",
          "obj": {
            "a": {
              "$numberInt": "1"
            },
            "b": {
              "$numberInt": "2"
            }
          },
          "n": {
            "$numberInt": "1"
          }
        },
        {
          "_id": {
            "$numberInt": "2"
          },
          "x": null,
          "a": [
            {
              "$numberInt": "2"
            },
            {
              "$numberInt": "3"
            }
          ],
          "profile": {
            "age": {
              "$numberInt": "17"
            }
          },
          "items": [
            {
              "v": {
                "$numberInt": "3"
              }
            }
          ],
          "s": "é",
          "obj": {
            "b": {
              "$numberInt": "2"
            },
            "a": {
              "$numberInt": "1"
            }
          },
          "n": {
            "$numberLong": "1"
          }
        },
        {
          "_id": {
            "$numberInt": "5"
          },
          "x": false,
          "a": [
            {
              "$numberInt": "2"
            }
          ],
          "profile": {
            "age": {
              "$numberInt": "18"
            }
          },
          "items": [
            {
              "v": {
                "$numberInt": "2"
              }
            },
            {
              "v": {